<?xml version="1.0" encoding="UTF-8"?>
<forms xmlns="http://definedFormData.config.wf.mast.org" xmlns:xsi="http://www.w3.org/2001/XMLSchema-instance" xsi:schemaLocation="http://definedFormData.config.wf.loushang.org definedFormdata.xsd ">
	 <form id="qingjia" name="请假流程">
	 	<url>qingjiaform.cmd</url>
		<buttons>
			<button id="create" name="启动流程" fun-name="tagCrtProcess()" description="启动流程"/>
			<button id="save" name="保存" fun-name="tagSave()" description="保存"/>
			<button id="forsend" name="选择发送" fun-name="tagForSend()" description="选择发送"/>
			<button id="send" name="发送" fun-name="tagSend()" description="直接发送"/>
			<button id="forreject" name="驳回" fun-name="tagForReject()" description="驳回"/>
			<button id="forflowhistory" name="流转历史" fun-name="tagForFlowHistory()" description="流传历史"/>
		</buttons>
		<fields>
			<field id="processid" name="主键" datatype="String" description="" checkfunction="">
		    </field>
			<field id="qjr" name="请假人" datatype="String" description="" checkfunction="">
		    </field>
		    <field id="ssbm" name="所属部门" datatype="String" description="" checkfunction="">
		    </field>
		    <field id="jb" name="假别" datatype="String" description="" checkfunction="">
		    </field>
		    <field id="ksrq" name="请假开始日期" datatype="String" description="" checkfunction="dateVerify">
		    </field>
		    <field id="jsrq" name="请假结束日期" datatype="String" description="" checkfunction="dateVerify">
		    </field>
		    <field id="ts" name="请假天数" datatype="Float" description="" checkfunction="plusIntVerify">
		    </field>
		    <field id="qjly" name="请假理由" datatype="String" description="" checkfunction="">
		    </field>
		    <field id="bmjl" name="所在部门经理" datatype="String" description="" checkfunction="">
		    </field>
		    <field id="bmjlyj" name="部门经理意见" datatype="String" description="" checkfunction="">
		    </field>
		    <field id="rlzybyj" name="人力资源部意见" datatype="String" description="" checkfunction="">
		    </field>
		    <field id="fgfzyj" name="分管副总意见" datatype="String" description="" checkfunction="">
		    </field>
		    <field id="bz" name="备注" datatype="String" description="" checkfunction="">
		    </field>
		    <!--   
		    <field id="USERDEPT" name="资产领用部门" datatype="String" description="">
				<select-field select-url="wf_struhelp.cmd?method=getSelectRoot&amp;organType=1,2&amp;isCheckBox=0&amp;isIncludeSelf=1&amp;isTree=1" module-key="organ_radio"/>
			</field>		
		    <field id="USEDATE" name="领用日期" datatype="String" description="">
				<date-time type="date"/>
			</field>
			-->						
		</fields>
	</form>
</forms>
